Name	Title	Series	Money	Description	Industries
TigerGraph	TigerGraph (105 M)	Series C	105000000.0	TigerGraph supports advanced analytics and machine learning platforms through its distributed native graph database.	Analytics, Data Visualization, Database, Enterprise Software, Machine Learning
Chili Piper	Chili Piper (33 M)	Series B	33000000.0	Chili Piper helps qualified leads automatically book a meeting or start a phone call right after they fill out a form.	B2B, Enterprise Software, Internet, Productivity Tools, SaaS, Sales, Sales Automation, Software
Deepgram	Deepgram (25 M)	Series B	25000000.0	Deepgram is a technology startup that develops an enterprise-focused automatic speech transcription and analysis platform.	Artificial Intelligence, Audio, Developer APIs, Speech Recognition
Redis Labs	Redis Labs (200 M)	Secondary Market	200000000.0	Redis Labs provides an in-memory database platform for applications and different services.	Analytics, Big Data, Database, Information Technology, Software
Unacademy	Unacademy (50 M)	Secondary Market	50000000.0	Unacademy is an online learning platform that provides educational content such as video lectures and examinations.	E-Learning, EdTech, Education, Training
Papa	Papa (60 M)	Series C	60000000.0	Papa is a platform that connects college students to senior citizens for companionship and assistance.	Elder Care, Elderly, Nursing and Residential Care
Carrum Health	Carrum Health (40 M)	Series A	40000000.0	Carrum Health is a digital marketplace the makes worldclass healthcare easier and less expensive — for everyone.	Health Care, Hospital, Marketplace
DealShare	DealShare (100 M)	Series D	100000000.0	DealShare is a fast growing social e-commerce startup	E-Commerce, Grocery, Group Buying, Retail Technology
Flipdish	Flipdish (49 M)	Series B	48524020.0	Flipdish helps on-demand food businesses create branded food ordering systems, websites, and apps.	Brand Marketing, E-Commerce, Food and Beverage, Food Delivery, Mobile Apps
Fetch	Fetch (300 M)	Venture - Series Unknown	300000000.0	Fetch, part of Dentsu Aegis Network, is a global mobile-first agency.	Advertising, Marketing, Mobile
